{
  "slug": "trang-bay",
  "title": "Tour 360° Sông Vân Art Space",
  "location": "Nam Hoa Lư, Ninh Bình",
  "summary": "Khám phá Sông Vân Art Space giữa làng nghề đá Ninh Vân. Dạo qua không gian sống, xưởng sáng tác và những khoảng trưng bày điêu khắc đá đương đại bằng trải nghiệm panorama 360°.",
  "duration": "Tự do",
  "theme": "minimal",
  "initialSceneId": "scene-c7",
  "plugins": [
    "navigation",
    "info"
  ],
  "scenes": [
    {
      "id": "scene-c1",
      "title": "Xưởng đá",
      "subtitle": "Điểm nhìn mở đầu, nơi tác phẩm đá gặp ánh sáng và cảnh quan Sông Vân.",
      "panorama": "/images/1788771876123.jpg",
      "thumbnail": "/thumbnails/trang-bay/1788771876123.jpg",
      "initialYaw": 0,
      "initialPitch": -0.05,
      "markers": [
        {
          "id": "h1790007426579",
          "label": "Cảnh mới",
          "yaw": -2.9193,
          "pitch": -0.3541,
          "plugin": "navigation",
          "targetScene": "scene-c2",
          "rotation": 0.05235987755982988,
          "rotZ": 0,
          "rotX": 0.890117918517108,
          "rotY": 0
        }
      ]
    },
    {
      "id": "scene-c2",
      "title": "Vườn Tượng",
      "subtitle": "Khoảng trưng bày ngoài trời kết nối cây xanh, mặt nước và điêu khắc.",
      "panorama": "/images/1788771876132.jpg",
      "thumbnail": "/thumbnails/trang-bay/1788771876132.jpg",
      "initialYaw": 0,
      "initialPitch": -0.05,
      "markers": [
        {
          "id": "h1790007374178",
          "label": "Khoảng trưng bày mở",
          "yaw": 2.3594,
          "pitch": -0.2871,
          "plugin": "navigation",
          "targetScene": "scene-c4",
          "rotX": 0.890117918517108
        },
        {
          "id": "h1790589811645",
          "label": "Xưởng đá",
          "yaw": -0.6684,
          "pitch": -0.1708,
          "plugin": "navigation",
          "targetScene": "scene-c1",
          "rotX": 0.8726646259971648
        },
        {
          "id": "h1790592598215",
          "label": "Cổng trừng bày 1",
          "yaw": 0.3657,
          "pitch": -0.3879,
          "plugin": "navigation",
          "targetScene": "scene-tb1-5",
          "rotX": 0.8726646259971648
        }
      ]
    },
    {
      "id": "scene-c3",
      "title": "Sảnh tân gia",
      "subtitle": "Sân trước khu nhà tân gia",
      "panorama": "/images/1788771876143.jpg",
      "thumbnail": "/thumbnails/trang-bay/1788771876143.jpg",
      "initialYaw": 0,
      "initialPitch": -0.05,
      "markers": [
        {
          "id": "h1790007786937",
          "label": "Không gian trừng bày mở",
          "yaw": -2.7305,
          "pitch": -0.3725,
          "plugin": "navigation",
          "targetScene": "scene-c4",
          "rotX": 0.8726646259971648,
          "rotZ": -0.6981317007977318,
          "rotY": 0.6457718232379019
        },
        {
          "id": "h1790007866785",
          "label": "Khu trưng bày 2",
          "yaw": 0.5523,
          "pitch": -0.2379,
          "plugin": "navigation",
          "targetScene": "scene-tb2-3",
          "rotX": 0.8726646259971648
        },
        {
          "id": "h1790587903930",
          "label": "Nhà tân gia",
          "yaw": -0.5243,
          "pitch": 0.4021,
          "plugin": "info",
          "content": "Khung sảnh chính của tân gia. "
        }
      ]
    },
    {
      "id": "scene-c4",
      "title": "Khoảng Trưng Bày Mở",
      "subtitle": "Không gian ngoài trời với tầm nhìn rộng dành cho các tác phẩm điêu khắc.",
      "panorama": "/images/1788771876162.jpg",
      "thumbnail": "/thumbnails/trang-bay/1788771876162.jpg",
      "initialYaw": 0,
      "initialPitch": -0.05,
      "markers": [
        {
          "id": "c4-next",
          "plugin": "navigation",
          "label": "Không Gian Bên Sông",
          "yaw": 1.9112,
          "pitch": -0.3851,
          "targetScene": "scene-c5",
          "rotX": 0.8726646259971648
        },
        {
          "id": "marker-navigation-1789271121754",
          "plugin": "navigation",
          "label": "Vườn tượng",
          "yaw": -0.928,
          "pitch": -0.2786,
          "targetScene": "scene-c2",
          "rotZ": 0.017453292519943295,
          "rotX": 0.8726646259971648
        },
        {
          "id": "marker-navigation-1789271195387",
          "plugin": "navigation",
          "label": "Sảnh tân gia",
          "yaw": -0.5325,
          "pitch": -0.2259,
          "targetScene": "scene-c3",
          "rotX": 0.890117918517108,
          "rotY": 0.03490658503988659,
          "rotZ": 0.20943951023931953
        }
      ]
    },
    {
      "id": "scene-c5",
      "title": "Không Gian Bên Sông",
      "subtitle": "Nơi cảnh quan Ninh Bình trở thành một phần của trải nghiệm nghệ thuật.",
      "panorama": "/images/1788771876173.jpg",
      "thumbnail": "/thumbnails/trang-bay/1788771876173.jpg",
      "initialYaw": 0,
      "initialPitch": -0.05,
      "markers": [
        {
          "id": "c5-next",
          "plugin": "navigation",
          "label": "Lỗi ra",
          "yaw": 1.467,
          "pitch": -0.2778,
          "targetScene": "scene-c4",
          "rotation": 0.5759586531581288,
          "rotZ": 0.715584993317675,
          "rotX": 0.8726646259971648,
          "rotY": -0.47123889803846897
        },
        {
          "id": "marker-navigation-1789273292044",
          "plugin": "navigation",
          "label": "Điểm đến mới",
          "yaw": -0.1823,
          "pitch": -0.3903,
          "targetScene": "scene-c4",
          "rotation": -0.9599310885968813,
          "rotX": 0.890117918517108,
          "rotZ": -1.2566370614359172,
          "rotY": 0.6457718232379019
        }
      ]
    },
    {
      "id": "scene-c6",
      "title": "Vườn Đá",
      "subtitle": "Những hình khối đá hiện diện giữa cây xanh và nhịp sống thường nhật.",
      "panorama": "/images/1788771876183.jpg",
      "thumbnail": "/thumbnails/trang-bay/1788771876183.jpg",
      "initialYaw": 0,
      "initialPitch": -0.05,
      "markers": []
    },
    {
      "id": "scene-c7",
      "title": "Cổng Sông Vân Art Space",
      "subtitle": "Điểm đón khách và cửa ngõ bước vào hành trình khám phá nghệ thuật.",
      "panorama": "/images/_storage_emulated_0_Pictures_AdobeLightroom_1788771876194.jpg",
      "thumbnail": "/thumbnails/trang-bay/_storage_emulated_0_Pictures_AdobeLightroom_1788771876194.jpg",
      "initialYaw": 0,
      "initialPitch": -0.05,
      "markers": [
        {
          "id": "marker-navigation-1789273190758",
          "plugin": "navigation",
          "label": "Lối vào",
          "yaw": -3.0244,
          "pitch": -0.4339,
          "targetScene": "scene-c5",
          "rotZ": -0.47123889803846897,
          "rotX": 0.8552113334772214,
          "rotY": 0
        },
        {
          "id": "marker-info-1789274132769",
          "plugin": "info",
          "label": "Cổng chính",
          "yaw": 2.627,
          "pitch": -0.0173,
          "content": "Sông Vân Art space…\nKhông gian nghệ thuật cũng là tư gia của gia đình nghệ sỹ Lương Trịnh mang tên Lương gia Art space đã là nơi khởi động những hoạt động nghệ thuật điêu khắc đá đương đại từ năm 2018 với workshop đầu tiên mang tên ‘Về với đá’, năm 2021 workshop và triển lãm điêu khắc đá Biến Chuyển. Mong muốn mở rộng và tạo lập một không gian trưng bày hoàn chỉnh hơn. Vừa tìm đến sự mới mẻ, hoà đồng với không gian sống, vừa tạo nên sự hấp dẫn của một điểm đến giữa lòng làng nghề đá. Lương gia Art space đã quyết định đổi tên thành Sông Vân Art space.  Triển lãm của hai tác giả cũng là sự khai mở cho một không gian mới, một khát vọng tạo dựng không gian cho đá của Lương Trịnh."
        }
      ]
    },
    {
      "id": "scene-tb1-1",
      "title": "Lối Vào Xưởng Đá",
      "subtitle": "Bắt đầu hành trình tìm hiểu quá trình vật liệu đá trở thành tác phẩm.",
      "panorama": "/images/trbay1/1788771876074.jpg",
      "thumbnail": "/thumbnails/trang-bay/1788771876074.jpg",
      "initialYaw": 0,
      "initialPitch": -0.05,
      "markers": [
        {
          "id": "h1790007757751",
          "label": "Cảnh mới",
          "yaw": -0.5348,
          "pitch": -0.3802,
          "plugin": "navigation",
          "targetScene": "scene-tb1-2",
          "rotX": 0.8726646259971648
        }
      ]
    },
    {
      "id": "scene-tb1-2",
      "title": "Sân Tập Kết Đá",
      "subtitle": "Không gian lưu giữ vật liệu và những hình khối đang chờ được đánh thức.",
      "panorama": "/images/trbay1/1788771876090.jpg",
      "thumbnail": "/thumbnails/trang-bay/1788771876090.jpg",
      "initialYaw": 0,
      "initialPitch": -0.05,
      "markers": [
        {
          "id": "h1790007718913",
          "label": "Góc chế tác",
          "yaw": -0.6099,
          "pitch": -0.3349,
          "plugin": "navigation",
          "targetScene": "scene-tb1-3",
          "rotX": 0.8726646259971648
        },
        {
          "id": "h1790593075340",
          "label": "Lối",
          "yaw": 2.3084,
          "pitch": -0.3378,
          "plugin": "navigation",
          "targetScene": "scene-tb1-1",
          "rotX": 0.8726646259971648
        }
      ]
    },
    {
      "id": "scene-tb1-3",
      "title": "Góc Chế Tác",
      "subtitle": "Nơi có thể quan sát dấu vết lao động và kỹ thuật của làng nghề đá.",
      "panorama": "/images/trbay1/1788771876098.jpg",
      "thumbnail": "/thumbnails/trang-bay/1788771876098.jpg",
      "initialYaw": 0,
      "initialPitch": -0.05,
      "markers": [
        {
          "id": "h1790007660078",
          "label": "Thông tin",
          "yaw": -2.3588,
          "pitch": -0.0096,
          "plugin": "info",
          "content": "Là một cái gì đó mà dùng để đựng đồ vật"
        },
        {
          "id": "h1790007689339",
          "label": "Trung tâm trừng bày 1",
          "yaw": 1.0567,
          "pitch": -0.4643,
          "plugin": "navigation",
          "targetScene": "scene-tb1-2",
          "rotX": 0.8726646259971648
        },